mco_id,mco_name,mco_owner,owner_id,address,city,state_abbreviation,zip,url,profit_status,private_public,telephone_one,telephone_two,fax,contracted_pbm,contracted_sp_vendor,service_areas,aliases,provider_sponsored,blues,al,ak,ar,az,ca,co,ct,dc,de,fl,ga,hi,ia,id,il,in,ks,ky,la,ma,me,mi,md,mn,ms,mo,mt,nc,nd,ne,nh,nj,nm,nv,ny,oh,ok,or,pa,ri,sc,sd,tn,tx,ut,va,vt,wa,wi,wv,wy,pr,foreign1816,Senior CommUnity Care of North Carolina,Volunteers of America National Services (VOANS).,,"4022 Stirrup Creek Drive, Suite 315",Durham,NC,27703,http://seniorcommunitycarenc.org,Not-for-profit,Private.,(919) 425-3000,(919) 425-3050,,,,North Carolina.,,FALSE,FALSE,0,0,0,0,0,0,0,0,0,0,0,0,0,0,0,0,0,0,0,0,0,0,0,0,0,0,0,20,0,0,0,0,0,0,0,0,0,0,0,0,0,0,0,0,0,0,0,0,0,0,0,0,0462,"Florida Health Care Plan, Inc.","Blue Cross and Blue Shield of Florida, Inc.",97,1340 Ridgewood Avenue,Holly Hill,FL,32117,www.fhcp.com,For-profit,Private.,(386) 676-7110,(800) 232-0578,(386) 676-7119,Catamaran Corporation,None,Florida.,,FALSE,FALSE,0,0,0,0,0,0,0,0,0,48956,0,0,0,0,0,0,0,0,0,0,0,0,0,0,0,0,0,0,0,0,0,0,0,0,0,0,0,0,0,0,0,0,0,0,0,0,0,0,0,0,0,0,0469,On Lok Lifeways,On Lok Senior Health Services.,,1333 Bush Street,San Francisco,CA,94109,www.onlok.org,Not-for-profit.,Private.,(415) 292-8888,(888) 886-6565,(415) 292-8745,,,California.,fka On Lok Senior Health Services.,FALSE,FALSE,0,0,0,0,1173,0,0,0,0,0,0,0,0,0,0,0,0,0,0,0,0,0,0,0,0,0,0,0,0,0,0,0,0,0,0,0,0,0,0,0,0,0,0,0,0,0,0,0,0,0,0,0,470,Independence Blue Cross (IBC),,25,1901 Market Street,Philadelphia,PA,19103,www.ibx.com,Not-for-profit,Private.,(215) 241-2400,(800) 275-2583,,Catamaran Corporation (FutureScripts),Catamaran Corporation (FutureScripts),"Delaware, Maryland, New Jersey, Pennsylvania.","Keystone Health Plan East, Inc.; Amerihealth HMO; QCC Insurance Company/Select Advantage; Healthcare Delaware; Vista Health Plan; Personal Choice PPO",FALSE,TRUE,4635,196,1179,3853,28369,4132,4794,1449,22554,21859,8356,219,2092,1487,19979,13507,1265,4088,2149,7720,1005,12195,21426,4485,3120,2339,746,14085,222,3305,2784,105674,2036,853,12745,8193,925,3200,1153294,365,6683,147,8604,12939,4201,15380,688,10333,2146,4827,96,17,29471,"Health New England, Inc.",Baystate Health.,,"One Monarch Place, Suite 1500",Springfield,MA,01144,www.hne.com,Not-for-profit,Private.,(413) 787-4000,(800) 310-2835,(413) 734-3356,Catamaran Corporation (Commercial/Medicaid); PTI/National Pharmaceutical Services and Welldyne Rx (Medicare Advantage),BriovaRx,Massachusetts.,"HNE Advisory Services, Inc.; HNE of Connecticut, Inc.; HNE Insurance Company, Inc.; HNE Insurance Services Corporation.",TRUE,FALSE,0,0,0,0,0,0,0,0,0,0,0,0,0,0,0,0,0,0,0,137555,0,0,0,0,0,0,0,0,0,0,0,0,0,0,0,0,0,0,0,0,0,0,0,0,0,0,0,0,0,0,0,0,472,"ADVANTAGE Health Solutions, Inc.","Ancilla Systems, St. Vincent Health, St. Joseph Regional Medical Center, Sisters of St. Francis of Perpetual Adoration.",,"9045 River Road, Suite 200",Indianapolis,IN,46240,www.advantageplan.com,For-profit.,Private.,(317) 573-2700,(877) 901-2237,(317) 580-8009,Envision Pharmaceutical Services,Orchard Pharmaceutical Services,Indiana.,,TRUE,FALSE,0,0,0,0,0,0,0,0,0,0,0,0,0,0,0,298992,0,0,0,0,0,0,0,0,0,0,0,0,0,0,0,0,0,0,0,0,0,0,0,0,0,0,0,0,0,0,0,0,0,0,0,0,531,Optima Health,Sentara Health Care.,,4417 Corporation Lane,Virginia Beach,VA,23462,www.optimahealth.com,Not-for-profit.,Private.,(757) 552-7300,(877) 552-7401,(757) 687-6031,Catamaran Corporation,BriovaRx,Virginia and Nationwide.,"Sentara Health Plans, Optima Health Plan, Optima Health Insurance Company. PACE Program is known as Sentara Senior Community Care/Sentara Life Care Corporation.",TRUE,FALSE,21,0,25,24,176,14,25,19,8,404,129,7,7,4,34,30,24,15,38,28,10,52,387,15,15,21,3,5512,0,0,13,48,2,11,106,52,10,17,179,2,156,11,65,160,23,429939,4,19,12,3581,6,5,8532,Piedmont Community Health Plan,Jointly owned by Centra Health and local physicians.,,1937 Thomson Drive,Lynchburg,VA,24501,www.pchp.net,For-profit.,Private.,(434) 947-4463,,(434) 947-3670,CVS/Caremark Rx,,Virginia.,"Piedmont Community HealthCare, PCHP.",TRUE,FALSE,13,0,3,2,4,4,0,5,0,32,46,0,0,1,18,7,0,26,3,0,0,6,33,1,0,2,2,48,0,0,0,6,0,1,9,7,10,0,4,0,6,0,7,31,0,30271,0,2,0,0,7,0,0213,"UPMC Health Plan, Inc.",UPMC.,92,"U.S. Steel Tower, 600 Grant Street",Pittsburgh,PA,15219,www.upmchealthplan.com,Not-for-profit.,Private.,(412) 454-7500,(888) 876-2756,(412) 454-7711,Express Scripts,Express Scripts,Pennsylvania and Nationwide.,"University of Pittsburgh Medical Center; UPMC for You, Inc.; UPMC Health Benefits Inc.; UPMC Health Network, UPMC Workpartners, LifeSolutions.",TRUE,FALSE,59,6,12,52,336,114,32,41,31,537,116,5,21,12,193,124,18,118,48,134,28,244,491,56,20,51,5,393,15,4,34,181,6,46,874,5582,6,34,829739,6,140,2,75,248,23,244,15,79,105,3895,5,1,25969,"Care Wisconsin Health Plan, Inc.","Care Wisconsin First, Inc.",,"2802 International Lane, P.O. Box 14017",Madison,WI,53708-0017,www.carewisc.org,Not-for-profit.,Private.,(608) 240-0020,(800) 963-0035,(608) 245-3077,PharmaStar,,Wisconsin.,Care Wisconsin Inc. and Care Wisconsin CMO.,FALSE,FALSE,0,0,0,0,0,0,0,0,0,0,0,0,0,0,0,0,0,0,0,0,0,0,0,0,0,0,0,0,0,0,0,0,0,0,0,0,0,0,0,0,0,0,0,0,0,0,0,0,1425,0,0,0,984,FirstCarolinaCare Insurance Company,FirstHealth of the Carolinas.,,P.O. Box 3000,Pinehurst,NC,28374,www.firstcarolinacare.com,Not-for-profit,Private.,(910) 715-8100,(800) 574-8556,(910) 715-8101,MedImpact Healthcare Systems,,North Carolina.,Kanawha Healthcare Solutions.,TRUE,FALSE,0,0,0,0,0,0,0,0,0,0,0,0,0,0,0,0,0,0,0,0,0,0,0,0,0,0,0,20417,0,0,0,0,0,0,0,0,0,0,0,0,0,0,0,0,0,0,0,0,0,0,0,0,1011,"Essence, Inc.",Essence Group Holdings Corporation.,,13900 Riverport Drive,Maryland Heights,MO,63043,www.essencehealthcare.com; http://lumeris.com,For-profit.,Private.,(314) 209-2700,(866) 597-9560,(314) 770-6096,,Schnucks Pharmacy,"Illinois, Missouri.","Essence Healthcare, Inc.",FALSE,FALSE,0,0,0,0,0,0,0,0,0,0,0,0,0,0,7217,0,0,0,0,0,0,0,0,0,0,30244,0,0,0,0,0,0,0,0,0,0,0,0,0,0,0,0,0,0,0,0,0,0,0,0,0,0,460,Geisinger Health Plan,Geisinger Health System.,,100 North Academy Avenue,Danville,PA,17822-3260,www.thehealthplan.com,Not-for-profit.,Private.,(570) 214-5265,(800) 447-4000,(570) 214-5285,"Pharmacy benefit managed internally. MedImpact Healthcare Systems (Claims Processing), Express Scripts (Medco) (Mail-order)",Internal,"Maine, New Jersey, Pennsylvania, West Virginia.","Geisinger Quality Options, Geisinger Health Plan (HMO), Geisinger Choice (PPO), Geisinger Health Options (self-funded).",TRUE,FALSE,7,1,2,25,75,17,30,6,36,155,56,0,4,2,29,134,2,21,2,53,11823,40,334,5,4,4,1,61,0,4,15,1188,2,22,352,107,3,3,406061,10,28,0,8,56,6,84,11,10,1,8375,1,1,1023,Elder Service Plan of Harbor Health,"Harbor Health Services, Inc.",,1135 Morton Street,Mattapan,MA,02126,www.elderserviceplan.org,Not-for-profit,Private.,(617) 533-2400,,(617) 533-2438,,,Massachusetts.,,TRUE,FALSE,0,0,0,0,0,0,0,0,0,0,0,0,0,0,0,0,0,0,0,415,0,0,0,0,0,0,0,0,0,0,0,0,0,0,0,0,0,0,0,0,0,0,0,0,0,0,0,0,0,0,0,0,1024,Elder Service Plan of the North Shore,,,37 Friend Street,Lynn,MA,01902,www.pacenorthshore.org,Not-for-profit.,Private.,(781) 715-6608,(781) 581-7565,(781) 715-6699,None,,Massachusetts.,,TRUE,FALSE,0,0,0,0,0,0,0,0,0,0,0,0,0,0,0,0,0,0,0,775,0,0,0,0,0,0,0,0,0,0,0,0,0,0,0,0,0,0,0,0,0,0,0,0,0,0,0,0,0,0,0,0,1025,Elder Service Plan of East Boston Health Center,The East Boston Neighborhood Health Center.,,"10 Gove Street and 20 Maverick Square, First Floor",East Boston,MA,02128,www.ebnhc.org/elderservice.php,Not-for-profit,Private.,(617) 568-6377,,(617) 568-4615,,,Massachusetts.,East Boston Elder Service Plan.,TRUE,FALSE,0,0,0,0,0,0,0,0,0,0,0,0,0,0,0,0,0,0,0,365,0,0,0,0,0,0,0,0,0,0,0,0,0,0,0,0,0,0,0,0,0,0,0,0,0,0,0,0,0,0,0,0,1197,"First Medical Health Plan, Inc.",,,PO Box 195080,San Juan,PR,00919-5080,www.firstmedicalpr.com and www.firstpluspr.com,For-profit.,Private.,(787) 474-3999,(888) 767-7717,(787) 474-3994,abarca health,,Puerto Rico.,First+Plus.,FALSE,FALSE,0,0,0,0,0,0,0,0,0,0,0,0,0,0,0,0,0,0,0,0,0,0,0,0,0,0,0,0,0,0,0,0,0,0,0,0,0,0,0,0,0,0,0,0,0,0,0,0,0,0,0,334664,1224,Cigna Corporation,Cigna Corporation.,,900 Cottage Grove Road,Bloomfield,CT,06152,www.cigna.com,For-profit.,Public.,(860) 226-6000,(800) 244-6224,,Cigna Pharmacy Management,Cigna Pharmacy Management,Nationwide.,"Alta Health and Life Insurance Company, Bravo Health, Cigna Behavioral Health, Cigna European Services (UK) Ltd, Cigna Health Corporation, Cigna Health Management, Cigna Healthcare of Arizona, Cigna Healthcare of California, Cigna Healthcare of Florida, Cigna Holdings, Connecticut General Life Insurance Company, Great-West Healthcare, Healthsource, HealthSpring, HealthSpring Management, Life Insurance Company of North America, Magnolia Cigna Corp.",FALSE,FALSE,101310,18502,66044,398355,1024233,464016,364506,27594,36366,1119999,596442,3165,46475,38066,502729,401247,100186,76866,145617,259851,81169,119767,354416,120350,99748,256511,127035,405057,8864,28950,141614,461780,33654,142075,670550,300888,86971,110091,348981,27194,177824,9312,810331,1269580,112909,422488,71149,215410,76799,44846,74545,741,"70,430"1236,Trillium Community Health Plan,"Agate Resources, Inc.",,P.O. Box 11756,Eugene,OR,97440-3956,www.trilliumchp.com,For-profit,Private.,(541) 431-1950,(800) 910-3906,(541) 984-5685,,,Oregon.,"Trillium Advantage, Sprout Healthy KidsConnect, Lane Individual Practice Association.",FALSE,FALSE,0,0,0,0,0,0,0,0,0,0,0,0,0,0,0,0,0,0,0,0,0,0,0,0,0,0,0,0,0,0,0,0,0,0,0,0,0,54164,0,0,0,0,0,0,0,0,0,0,0,0,0,0,1237,VNSNY CHOICE,Affiliate of the Visiting Nurse Service of New York.,,"1250 Broadway, 11th Floor",New York,NY,10001,www.vnsnychoice.org,Not-for-profit.,Private.,(888) 867-6555,,,CVS/Caremark Rx,,New York.,"fka VNS CHOICE Select, VNSNY CHOICE Medicare.",TRUE,FALSE,0,0,0,0,0,0,0,0,0,0,0,0,0,0,0,0,0,0,0,0,0,0,0,0,0,0,0,0,0,0,0,0,0,0,36527,0,0,0,0,0,0,0,0,0,0,0,0,0,0,0,0,0,1598,Senior LIFE Altoona,Grane Healthcare.,104,401 Broad Street,Johnstown,PA,15905,www.seniorlifeebensburg.com,Not-for-profit,Private.,(814) 943-2273,,,,,Pennsylvania.,Senior LIFE Ebensburg.,TRUE,FALSE,0,0,0,0,0,0,0,0,0,0,0,0,0,0,0,0,0,0,0,0,0,0,0,0,0,0,0,0,0,0,0,0,0,0,0,0,0,0,129,0,0,0,0,0,0,0,0,0,0,0,0,0,1599,Senior LIFE York,Grane Healthcare.,104,1460 Memory Lane Extended,York,PA,17402,www.seniorlifeyork.com,Not-for-profit,Private.,(877) 998-5433,,,,,Pennsylvania.,York County PACE.,TRUE,FALSE,0,0,0,0,0,0,0,0,0,0,0,0,0,0,0,0,0,0,0,0,0,0,0,0,0,0,0,0,0,0,0,0,0,0,0,0,0,0,210,0,0,0,0,0,0,0,0,0,0,0,0,0,1600,Senior LIFE Washington,Grane Healthcare.,104,209 Sigma Drive,Pittsburgh,PA,15238,www.seniorlifewashington.com,Not-for-profit,Private.,(877) 998-5433,,,,,Pennsylvania.,"Senior LIFE Johnstown, Pennsylvania PACE, Inc.",TRUE,FALSE,0,0,0,0,0,0,0,0,0,0,0,0,0,0,0,0,0,0,0,0,0,0,0,0,0,0,0,0,0,0,0,0,0,0,0,0,0,0,370,0,0,0,0,0,0,0,0,0,0,0,0,0,1601,Inspira LIFE,"South Jersey Health System, Inc.",,2445 South Delsea Drive,Vineland,NJ,08360,www.inspirahealthnetwork.org/life-center,Not-for-profit,Private.,(855) 295-5433,,,,,New Jersey.,"SJH LIFE, Inspira LIFE Vineland.",TRUE,FALSE,0,0,0,0,0,0,0,0,0,0,0,0,0,0,0,0,0,0,0,0,0,0,0,0,0,0,0,0,0,0,0,130,0,0,0,0,0,0,0,0,0,0,0,0,0,0,0,0,0,0,0,0,1515,NewCourtland LIFE Program,NewCourtland.,,5457 Wayne Avenue,Philadelphia,PA,19144,www.newcourtlandlife.org,Not-for-profit.,Private.,(888) 530-4913,(267) 335-1500,(267) 286-8250,PharmaStar,Medicine Shoppe,Pennsylvania.,,TRUE,FALSE,0,0,0,0,0,0,0,0,0,0,0,0,0,0,0,0,0,0,0,0,0,0,0,0,0,0,0,0,0,0,0,0,0,0,0,0,0,0,297,0,0,0,0,0,0,0,0,0,0,0,0,0,1528,HHH Choices Health Plan,Hebrew Hospital Home.,,55 Grasslands Road,Valhalla,NY,10595,www.hhhchoiceshealthplan.org,Not-for-profit.,Private.,(866) 663-9877,,(914) 989-7868,Envision Rx,,New York.,Hebrew Hospital Home; HHH Choices MLTC.,TRUE,FALSE,0,0,0,0,0,0,0,0,0,0,0,0,0,0,0,0,0,0,0,0,0,0,0,0,0,0,0,0,0,0,0,0,0,0,2357,0,0,0,0,0,0,0,0,0,0,0,0,0,0,0,0,0,1100,"America's 1st Choice Holdings, Inc.","America's 1st Choice Holdings, Inc.",100,5403 North Church Avenue,Tampa,FL,33614,www.freedomhealth.com AND www.youroptimumhealthcare.com,For-profit.,Private.,(866) 245-5360,(800) 401-2740,(813) 506-6150,,,Florida.,"Freedom Health, Inc.; Optimum HealthCare, Inc.; Freedom First.",TRUE,FALSE,0,0,0,0,0,0,0,0,0,125633,0,0,0,0,0,0,0,0,0,0,0,0,0,0,0,0,0,0,0,0,0,0,0,0,0,0,0,0,0,0,0,0,0,0,0,0,0,0,0,0,0,0,1393,"Viecare Beaver LLC, dba LIFE Beaver County",Lutheran SeniorLife.,,"131 Pleasant Drive, Suite 1",Aliquippa,PA,15001,www.lutheranseniorlife.org/LIFE,Not-for-profit.,Private.,(724) 378-5400,,(724) 302-2093,PeakPACE Solutions,Care Kinesis,Pennsylvania.,LIFE Beaver and Lawrence Counties.,TRUE,FALSE,0,0,0,0,0,0,0,0,0,0,0,0,0,0,0,0,0,0,0,0,0,0,0,0,0,0,0,0,0,0,0,0,0,0,0,0,0,0,428,0,0,0,0,0,0,0,0,0,0,0,0,0,1398,Univera Healthcare,"Excellus Health Plans, Inc.",61,P.O. Box 23000,Rochester,NY,14692,www.univerahealthcare.com,Not-for-profit.,Private.,(716) 847-1480,,,,,New York.,,FALSE,FALSE,0,0,0,0,0,0,0,0,0,0,0,0,0,0,0,0,0,0,0,0,0,0,0,0,0,0,0,0,0,0,0,0,0,0,78351,0,0,0,0,0,0,0,0,0,0,0,0,0,0,0,0,0,1193,MCS Life Insurance Company,"Medical Card System, Inc. and WellPoint, Inc.",3,"MCS Plaza, 1st Floor, Suite 105, 255 Ponce de Leon Avenue",San Juan,PR,00916-1919,www.mcsclassicare.com/en,For-profit.,Private subsidiary of public company.,(866) 627-8183,(787) 620-2530,(787) 620-0986,,,"Connecticut, Florida, Massachusetts, New York, Puerto Rico.","MCS Advantage, Inc.; MCS Classicare (HMO).",FALSE,FALSE,0,0,0,0,0,0,16,0,0,99,0,0,0,0,0,0,0,0,0,11,0,0,0,0,0,0,0,0,0,0,0,0,0,0,17,0,0,0,0,0,0,0,0,0,0,0,0,0,0,0,0,129507,1293,Hope HealthCare Services,"Hope of Southwest Florida, Inc.",,9470 HealthPark Circle,Fort Myers,FL,33908,www.hopehcs.org,Not-for-profit.,Private.,(239) 482-4673,(800) 835-1673,,,,Florida.,"Hope PACE fka Hope Select Care, Hope Hospice and Community Services",TRUE,FALSE,0,0,0,0,0,0,0,0,0,230,0,0,0,0,0,0,0,0,0,0,0,0,0,0,0,0,0,0,0,0,0,0,0,0,0,0,0,0,0,0,0,0,0,0,0,0,0,0,0,0,0,0,1294,KelseyCare Advantage,"KS Plan Administrators, LLC.",,11511 Shadow Creek Parkway,Pearland,TX,77584,www.kelseycareadvantage.com,For-profit.,Private.,(713) 442-2377,(866) 535-8343,(713) 442-9541,Catamaran Corporation,,Texas.,,TRUE,FALSE,0,0,0,0,0,0,0,0,0,0,0,0,0,0,0,0,0,0,0,0,0,0,0,0,0,0,0,0,0,0,0,0,0,0,0,0,0,0,0,0,0,0,0,24381,0,0,0,0,0,0,0,0,1298,"Mountain Empire Older Citizens, Inc.",,,1501 Third Avenue East,Big Stone Gap,VA,24219,www.meoc.org,Not-for-profit,Private.,(276) 523-4202,(800) 252-6362,(276) 523-4208,,,Virginia.,Mountain Empire PACE.,TRUE,FALSE,0,0,0,0,0,0,0,0,0,0,0,0,0,0,0,0,0,0,0,0,0,0,0,0,0,0,0,0,0,0,0,0,0,0,0,0,0,0,0,0,0,0,0,0,0,90,0,0,0,0,0,0,1310,Elderhaus PACE,"Elderhaus, Inc.",,2222 South 17th Street,Wilmington,NC,28401,www.elderhaus.com/pace/index.htm,Not-for-profit.,Private.,(910) 343-8209,,(910) 343-8836,,,North Carolina.,,TRUE,FALSE,0,0,0,0,0,0,0,0,0,0,0,0,0,0,0,0,0,0,0,0,0,0,0,0,0,0,0,114,0,0,0,0,0,0,0,0,0,0,0,0,0,0,0,0,0,0,0,0,0,0,0,0,1311,"GuildNet, Inc.",Jewish Guild Healthcare.,,15 West 65th Street,New York,NY,10023,www.guildnetny.org,Not-for-profit.,Private.,(212) 769-6200,(800) 284-4422,,,,New York.,Jewish Guild Healthcare (Formerly Jewish Guild for the Blind).,TRUE,FALSE,0,0,0,0,0,0,0,0,0,0,0,0,0,0,0,0,0,0,0,0,0,0,0,0,0,0,0,0,0,0,0,0,0,0,14929,0,0,0,0,0,0,0,0,0,0,0,0,0,0,0,0,0,1263,UnitedHealthcare,UnitedHealth Group.,,9700 Health Care Lane,Minnetonka,MN,55343,www.uhc.com,For-profit.,Public.,(888) 545-5205,(800) 307-7820,(952) 936-1949,OptumRx,,Nationwide.,"All Savers Insurance Company, AmeriChoice, Arizona Physicians IPA, Arnett Health Plans, Better Health Plans of South Carolina, Citrus Health Care, Erickson Advantage, Evercare, Fiserv, Great Lakes Health Plan, Health Net of Connecticut, Health Plan of Nevada, John Deere Health Plan, Inc., MAMSI, MD-IPA, Medica Healthcare Plans, Neighborhood Health Partnership, Optimum Choice, Oxford Health Plans, PacifiCare, Physicians Health Choice, Preferred Care Partners, Sierra Health and Life Insurance Company, Sierra Spectrum, Three Rivers Health Plan, Unison Health Plan, UnitedHealthcare Community Plan, XLHealth Corporation/Care Improvement Plus.",FALSE,FALSE,41946,11,29279,493623,834329,100869,79460,1349,65929,802033,230724,52363,28940,13758,1050275,60851,122902,30164,260965,33831,6670,239991,326528,946,72724,220693,2144,139622,314,73857,6885,965651,36599,437284,3063820,263080,47268,40275,266408,79337,84396,115,644432,538357,50809,9796,6749,148253,266384,2195,1745,0,1382,"LIFE Lutheran Services, Inc.",Lutheran Social Services of South Central Pennsylvania.,,840 Fifth Avenue,Chambersburg,PA,17201,www.lifelutheranservices.org,Not-for-profit.,Private.,(717) 264-5433,,,,,Pennsylvania.,,FALSE,FALSE,0,0,0,0,0,0,0,0,0,0,0,0,0,0,0,0,0,0,0,0,0,0,0,0,0,0,0,0,0,0,0,0,0,0,0,0,0,0,59,0,0,0,0,0,0,0,0,0,0,0,0,0,1383,LIFE St. Francis,St. Francis Medical Center/Catholic Health East.,,1435 Liberty Street,Hamilton,NJ,08629,www.stfrancismedical.org/LIFE,Not-for-profit.,Private.,(609) 599-5433,,(609) 475-4661,Care Kinesis,Care Kinesis,"Delaware, New Jersey.",,TRUE,FALSE,0,0,0,0,0,0,0,0,45,0,0,0,0,0,0,0,0,0,0,0,0,0,0,0,0,0,0,0,0,0,0,225,0,0,0,0,0,0,0,0,0,0,0,0,0,0,0,0,0,0,0,0,1384,LifeCircles PACE,A Porter Hills PACE Partnership,,560 Seminole Road,Muskegon,MI,49444,www.lifecircles-pace.org,Not-for-profit.,Private.,(231) 733-8686,,(231) 733-8683,,,Michigan.,,TRUE,FALSE,0,0,0,0,0,0,0,0,0,0,0,0,0,0,0,0,0,0,0,0,0,225,0,0,0,0,0,0,0,0,0,0,0,0,0,0,0,0,0,0,0,0,0,0,0,0,0,0,0,0,0,0,1385,Northland PACE Program,Northland Healthcare Alliance.,,201 North 24th Street,Bismarck,ND,58501,www.northlandpace.com,Not-for-profit,Private.,(701) 751-3050,(888) 883-8959,,,,North Dakota.,"Northland PACE Senior Care Services, Northland PACE Bismarck, Northland PACE Dickinson.",TRUE,FALSE,0,0,0,0,0,0,0,0,0,0,0,0,0,0,0,0,0,0,0,0,0,0,0,0,0,0,0,0,74,0,0,0,0,0,0,0,0,0,0,0,0,0,0,0,0,0,0,0,0,0,0,0,1387,everyday LIFE,Senior LIFE Lehigh Valley.,,"2045 Westgate Drive, Suite 100",Bethlehem,PA,18017,www.everydaylifecenters.org,Not-for-profit,Private.,(610) 954-5433,(877) 895-4330,(484) 895-4391,,,Pennsylvania.,PHI LIFE.,TRUE,FALSE,0,0,0,0,0,0,0,0,0,0,0,0,0,0,0,0,0,0,0,0,0,0,0,0,0,0,0,0,0,0,0,0,0,0,0,0,0,0,120,0,0,0,0,0,0,0,0,0,0,0,0,0,358,Sanford Heart of America Health Plan,Sanford Health.,111,810 South Main Avenue,Rugby,ND,58368,www.hoahp.com,Not-for-profit.,Private.,(701) 776-5848,(800) 525-5661,(701) 776-5425,None,None,North Dakota.,Heart of America HMO,TRUE,FALSE,0,0,0,0,0,0,0,0,0,0,0,0,0,0,0,0,0,0,0,0,0,0,0,0,0,0,0,0,975,0,0,0,0,0,0,0,0,0,0,0,0,0,0,0,0,0,0,0,0,0,0,0,361,Blue Cross Blue Shield of Michigan,Blue Cross Blue Shield of Michigan.,,600 East Lafayette Boulevard,Detroit,MI,48226,www.bcbsm.com,Not-for-profit.,Private.,(877) 469-2583,,,Express Scripts (Medco),Option Care,"Michigan, plus Medicare Advantage plans nationwide.","Blue Cross Complete, Blue Care Network of Michigan, BlueCaid of Michigan, M-CARE.",FALSE,TRUE,1506,0,112,2121,1535,454,36,21,0,8864,570,29,12,34,487,7626,23,882,11,382,31,2177615,51,259,60,109,23,1328,0,0,0,524,150,542,23,2000,40,121,588,0,1038,28,2302,743,33,322,0,221,307,0,0,0,362,HealthPlus of Michigan and HealthPlus Insurance,HealthPlus of Michigan.,,2050 South Linden Road,Flint,MI,48532,www.healthplus.org,Not-for-profit,Private.,(810) 230-2000,(800) 332-9161,(810) 230-2208,"Internal, Catamaran Corporation (pharmacy claims processor)","BioScrip, Diplomat Specialty Pharmacy, Axium Pharmacy",Michigan and Nationwide.,"HealthPlus Partners, Inc.",FALSE,FALSE,23,0,77,52,440,31,27,1,0,238,103,1,19,13,78,112,24,8,5,10,74,231730,9,21,0,33,1,24,0,0,14,69,4,8,76,300,18,66,44,5,30,1,96,411,20,9,0,19,335,0,0,0,8483,CommunityCare Managed Healthcare Plans of Oklahoma,Saint Francis Hospital and St. John Medical Center.,,218 West 6th Street,Tulsa,OK,74119,www.ccok.com,For-profit.,Private.,(918) 594-5200,(800) 278-7563,(918) 594-5210,,,Oklahoma.,"CommunityCare Senior Health Plan; CommunityCare HMO, Inc.; CommunityCare Life & Health Insurance Company.",TRUE,FALSE,0,0,0,0,0,0,0,0,0,0,0,0,0,0,0,0,0,0,0,0,0,0,0,0,0,0,0,0,0,0,0,0,0,0,0,0,130584,0,0,0,0,0,0,0,0,0,0,0,0,0,0,0,1666,"Florida Healthcare Plus, Inc.",,,"2100 Ponce De Leon Boulevard, Suite PH1",Coral Gables,FL,33134,www.floridahealthcareplus.com,For-profit.,Private.,(305) 888-2210,,,,,Florida.,,TRUE,FALSE,0,0,0,0,0,0,0,0,0,10097,0,0,0,0,0,0,0,0,0,0,0,0,0,0,0,0,0,0,0,0,0,0,0,0,0,0,0,0,0,0,0,0,0,0,0,0,0,0,0,0,0,0,1667,Immanuel Pathways,Immanuel.,,"5858 Wenninghoff Road, Suite 2",Omaha,NE,68134,www.immanuelpathways.org,Not-for-profit.,Private.,(402) 829-2934,(712) 256-7284,,,,"Iowa, Nebraska.","PACE Nebraska, PACE Iowa.",TRUE,FALSE,0,0,0,0,0,0,0,0,0,0,0,0,57,0,0,0,0,0,0,0,0,0,0,0,0,0,0,0,0,24,0,0,0,0,0,0,0,0,0,0,0,0,0,0,0,0,0,0,0,0,0,0,1668,InovaCares for Seniors,"Inova Health Systems, Inc.",,4027-B Olley Lane,Fairfax,VA,22032,http://inova.org/pace,Not-for-profit,Private.,(703) 239-5888,(703) 239-5878,,,,Virginia.,,TRUE,FALSE,0,0,0,0,0,0,0,0,0,0,0,0,0,0,0,0,0,0,0,0,0,0,0,0,0,0,0,0,0,0,0,0,0,0,0,0,0,0,0,0,0,0,0,0,0,37,0,0,0,0,0,0,1669,Mercy LIFE of Alabama,Mercy Medical.,,2900 Springhill Avenue,Mobile,AL,36607,www.mercylifeal.com,Not-for-profit,Private.,(251) 621-4223,,,,,Alabama.,,TRUE,FALSE,125,0,0,0,0,0,0,0,0,0,0,0,0,0,0,0,0,0,0,0,0,0,0,0,0,0,0,0,0,0,0,0,0,0,0,0,0,0,0,0,0,0,0,0,0,0,0,0,0,0,0,0,1670,Pace@Home,,,"1915 Fairgrove Church Road, SE",Newton,NC,28658,www.pace-at-home.org,Not-for-profit,Private.,(828) 468-3980,,,,,North Carolina.,,TRUE,FALSE,0,0,0,0,0,0,0,0,0,0,0,0,0,0,0,0,0,0,0,0,0,0,0,0,0,0,0,63,0,0,0,0,0,0,0,0,0,0,0,0,0,0,0,0,0,0,0,0,0,0,0,0,1672,PACE of Southwest Michigan,Area Agency on Aging.,,2900 Lakeview Avenue,St. Joseph,MI,49085,www.areaagencyonaging.org,Not-for-profit,Private.,(269) 408-4322,(800) 654-2810,,,,Michigan.,,FALSE,FALSE,0,0,0,0,0,0,0,0,0,0,0,0,0,0,0,0,0,0,0,0,0,59,0,0,0,0,0,0,0,0,0,0,0,0,0,0,0,0,0,0,0,0,0,0,0,0,0,0,0,0,0,0,1673,Carolina SeniorCare,United Church Homes and Services.,,802 East Center Street,Lexington,NC,87292,www.carolinaseniorcare.org,Not-for-profit,Private.,(336) 746-3500,,(888) 351-7227,,,North Carolina.,,TRUE,FALSE,0,0,0,0,0,0,0,0,0,0,0,0,0,0,0,0,0,0,0,0,0,0,0,0,0,0,0,77,0,0,0,0,0,0,0,0,0,0,0,0,0,0,0,0,0,0,0,0,0,0,0,0,1674,CrestPoint Health,Integrated Solutions Health Network/Mountain States Health Alliance.,,P.O. Box 3620,Akron,OH,44309,www.crestpointhealth.com,For-profit,Private.,(888) 261-0417,(423) 952-2190,(330) 996-8953,,,Tennessee.,,TRUE,FALSE,0,0,0,0,0,0,0,0,0,0,0,0,0,0,0,0,0,0,0,0,0,0,0,0,0,0,0,0,0,0,0,0,0,0,0,0,0,0,0,0,0,0,273,0,0,0,0,0,0,0,0,0,1720,CarePoint Health Plans,IJKG Opco LLC.,,"Harborside Financial Center, 1510 Plaza 5",Jersey City,NJ,07311,www.carepointadvantage.org,For-profit,Private.,(855) 593-5757,(888) 657-1207,(732) 412-4343,,,New Jersey.,CarePoint Insurance Company.,TRUE,FALSE,0,0,0,0,0,0,0,0,0,0,0,0,0,0,0,0,0,0,0,0,0,0,0,0,0,0,0,0,0,0,0,276,0,0,0,0,0,0,0,0,0,0,0,0,0,0,0,0,0,0,0,0,243,"MetroPlus Health Plan, Inc.",New York City Health and Hospitals Corporation.,,"160 Water Street, Third Floor",New York,NY,10038,www.metroplus.org,Not-for-profit.,Government.,(212) 908-8600,(800) 303-9626,(212) 908-8601,CVS/Caremark Rx,CVS/Caremark Rx,New York.,,TRUE,FALSE,0,0,0,0,0,0,0,0,0,0,0,0,0,0,0,0,0,0,0,0,0,0,0,0,0,0,0,0,0,0,0,0,0,0,418151,0,0,0,0,0,0,0,0,0,0,0,0,0,0,0,0,0,251,Meridian Health Plan of Michigan,,109,"777 Woodward Avenue, Suite 600",Detroit,MI,48226,www.mhplan.com/mi,For-profit.,Private.,(313) 324-3700,(888) 437-0606,(313) 202-0007,Meridian Rx,Meridian Rx,Michigan.,"fka Health Plan of Michigan, Inc.",FALSE,FALSE,0,0,0,0,0,0,0,0,0,0,0,0,0,0,0,0,0,0,0,0,0,296254,0,0,0,0,0,0,0,0,0,0,0,0,0,0,0,0,0,0,0,0,0,0,0,0,0,0,0,0,0,0,252,McLaren Health Plan,McLaren Health Care Corporation.,,G-3245 Beecher Road,Flint,MI,48532,www.mclarenhealthplan.org,Not-for-profit.,Private.,(888) 327-0671,,,4D Pharmacy Management Systems,,Michigan.,,TRUE,FALSE,0,0,0,0,0,0,0,0,0,0,0,0,0,0,0,0,0,0,0,0,0,198562,0,0,0,0,0,0,0,0,0,0,0,0,0,0,0,0,0,0,0,0,0,0,0,0,0,0,0,0,0,0,254,Easy Choice Health Plan of New York,"Atlantis Health Systems, Inc.",,"45 Broadway, Suite 300",New York,NY,10006,www.easychoiceny.com,For-profit.,Private.,(212) 747-0877,(866) 747-8422,(212) 747-0843,Catamaran Corporation,,New York.,Formerly Atlantis Heatlh Plan.,TRUE,FALSE,0,0,0,0,0,0,0,0,0,0,0,0,0,0,0,0,0,0,0,0,0,0,0,0,0,0,0,0,0,0,0,0,0,0,12850,0,0,0,0,0,0,0,0,0,0,0,0,0,0,0,0,0,0255,Paramount Insurance Company,ProMedica Health System.,31,1901 Indian Wood Circle,Maumee,OH,43537,www.paramounthealthcare.com,For-profit.,Private.,(419) 887-2500,(419) 887-2525,(419) 887-2017,Express Scripts,,"Ohio, Michigan.","Paramount Advantage; Paramount Care, Inc.",TRUE,FALSE,0,0,0,0,0,0,0,0,0,0,0,0,0,0,0,0,0,0,0,0,0,4351,0,0,0,0,0,0,0,0,0,0,0,0,0,234212,0,0,0,0,0,0,0,0,0,0,0,0,0,0,0,0,257,CareSource,CareSource Management Group.,,230 North Main Street,Dayton,OH,45402,www.caresource.com,Not-for-profit.,Private.,(937) 224-3300,,(937) 224-2272,CVS/Caremark Rx,CVS/Caremark Rx,"Kentucky, Michigan, Ohio.","Dayton Area Health Plan, CareSource Ohio, Humana CareSource, CareSource Humana.",FALSE,FALSE,0,0,0,0,0,0,0,0,0,0,0,0,0,0,0,0,0,15288,0,0,0,532,0,0,0,0,0,0,0,0,0,0,0,0,0,971333,0,0,0,0,0,0,0,0,0,0,0,0,0,0,0,0,0317,Gateway Health Plan,"Highmark, Inc. and Mercy Health Plan.",6,"Four Gateway Center, 444 Liberty Avenue, Suite 2100",Pittsburgh,PA,15222-1222,www.gatewayhealthplan.com,For-profit.,Private.,(412) 255-4640,(888) 428-3929,,Argus Health Systems,,Pennsylvania.,"Gateway Health Medicare Assured, Gateway Health Plan.",FALSE,FALSE,0,0,0,0,0,0,0,0,0,0,0,0,0,0,0,0,0,0,0,0,0,0,0,0,0,0,0,0,0,0,0,0,0,0,0,0,0,0,301103,0,0,0,0,0,0,0,0,0,0,0,0,0,