mco_id,mco_name,mco_owner,owner_id,address,city,state_abbreviation,zip,url,profit_status,private_public,telephone_one,telephone_two,fax,contracted_pbm,contracted_sp_vendor,service_areas,aliases,provider_sponsored,blues,al,ak,ar,az,ca,co,ct,dc,de,fl,ga,hi,ia,id,il,in,ks,ky,la,ma,me,mi,md,mn,ms,mo,mt,nc,nd,ne,nh,nj,nm,nv,ny,oh,ok,or,pa,ri,sc,sd,tn,tx,ut,va,vt,wa,wi,wv,wy,pr,foreign800,"Quality Health Plans, Inc.","QHP Financial Group, Inc.",,"2805 Veterans Memorial Highway, Suite 17",Ronkonkoma,NY,11779,www.qualityhealthplansny.com,For-profit.,Private.,(877) 233-7058,,(877) 817-1008,,,New York.,Quality Health Plans of New York (QHPNY).,TRUE,FALSE,0,0,0,0,0,0,0,0,0,0,0,0,0,0,0,0,0,0,0,0,0,0,0,0,0,0,0,0,0,0,0,0,0,0,129,0,0,0,0,0,0,0,0,0,0,0,0,0,0,0,0,0,804,PacificSource Health Plans,,,110 International Way,Springfield,OR,97477,www.pacificsource.com,Not-for-profit.,Private.,(541) 686-1242,(888) 977-9299,(541) 225-3645,CVS/Caremark Rx,CVS/Caremark Rx,"Idaho, Montana, Oregon.",Primary Health Network dba PacificSource Health Plans of Idaho.,FALSE,FALSE,0,0,0,0,0,0,0,0,0,0,0,0,0,56399,0,0,0,0,0,0,0,0,0,0,0,0,17302,0,0,0,0,0,0,0,0,0,0,204846,0,0,0,0,0,0,0,0,0,0,0,0,0,0,193,"Total Health Care, Inc.","Total Health Care USA, Inc.",,"3011 West Grand Boulevard, Suite 1600",Detroit,MI,48202,www.thcmi.com,Not-for-profit.,Private.,(313) 871-2000,(800) 826-2862,(313) 871-6407,Catamaran Corporation,CVS/Caremark Rx (Rx America),Michigan.,Total Medicare Plus.,TRUE,FALSE,0,0,0,0,0,0,0,0,0,0,0,0,0,0,0,0,0,0,0,0,0,92246,0,0,0,0,0,0,0,0,0,0,0,0,0,0,0,0,0,0,0,0,0,0,0,0,0,0,0,0,0,0,1063,Alexian Brothers Community Services,Ascension Health.,,"425 Cumberland Street, Suite 110",Chattanooga,TN,37404,www.alexianbrothers.net,Not-for-profit,Private.,(423) 698-0802,(423) 495-9114,(423) 622-6048,,,"Missouri, Tennessee.",,TRUE,FALSE,0,0,0,0,0,0,0,0,0,0,0,0,0,0,0,0,0,0,0,0,0,0,0,0,0,158,0,0,0,0,0,0,0,0,0,0,0,0,0,0,0,0,285,0,0,0,0,0,0,0,0,0,1076,Senior Whole Health,"SWH Holdings, Inc.",,58 Charles Street,Cambridge,MA,02141,www.seniorwholehealth.com,For-profit.,Private.,(617) 494-5353,(888) 749-6455,(617) 494-5599,Express Scripts,,"Massachusetts, New York.",,FALSE,FALSE,0,0,0,0,0,0,0,0,0,0,0,0,0,0,0,0,0,0,0,8868,0,0,0,0,0,0,0,0,0,0,0,0,0,0,15,0,0,0,0,0,0,0,0,0,0,0,0,0,0,0,0,0,103,Denver Health Medical Plan,Denver Health and Hospital Authority.,,"777 Bannock Street, MC 6000",Denver,CO,80204,www.denverhealthmedicalplan.com,Not-for-profit.,Private.,(303) 602-2100,(800) 700-8140,(303) 602-2096,MedImpact Healthcare Systems,,Colorado.,,FALSE,FALSE,0,0,0,0,0,71599,0,0,0,0,0,0,0,0,0,0,0,0,0,0,0,0,0,0,0,0,0,0,0,0,0,0,0,0,0,0,0,0,0,0,0,0,0,0,0,0,0,0,0,0,0,0,105,Colorado Choice Health Plans,,,"700 Main Street, Suite 100",Alamosa,CO,81101,www.cochoice.com,Not-for-profit.,Private.,(719) 589-3696,(800) 475-8466,(719) 589-4901,"Prescription Solutions, WellDyne Rx, Catamaran Corporation",,Colorado.,,FALSE,FALSE,0,0,0,0,0,10145,0,0,0,0,0,0,0,0,0,0,0,0,0,0,0,0,0,0,0,0,0,0,0,0,0,0,0,0,0,0,0,0,0,0,0,0,0,0,0,0,0,0,0,0,0,0,110,"ConnectiCare, Inc.","EmblemHealth, Inc.",13,175 Scott Swamp Road,Farmington,CT,06032,www.connecticare.com,For-profit.,Private.,(860) 674-5700,(800) 251-7722,(860) 674-5728,Express Scripts,"Express Scripts (Curascript), Walgreens Specialty Pharmacy, ICORE Healthcare","Connecticut, Massachusetts.","ConnectiCare Insurance Company, Inc.",FALSE,FALSE,5,0,0,17,37,11,216344,8,3,203,20,0,3,0,13,6,0,9,6,3371,64,21,37,3,12,11,0,35,0,0,95,65,3,3,1138,31,4,7,49,248,38,0,29,58,3,37,20,19,4,4,2,4,587,Mount Carmel Health Plan,Trinity Health.,,"6150 East Broad Street, Suite EE320",Columbus,OH,43213,www.medigold.com,Not-for-profit.,Private.,(800) 964-4525,(800) 991-9907,(614) 546-3132,CVS/Caremark Rx,,Ohio.,MediGold.,TRUE,FALSE,0,0,0,0,0,0,0,0,0,0,0,0,0,0,0,0,0,0,0,0,0,0,0,0,0,0,0,0,0,0,0,0,0,0,0,38068,0,0,0,0,0,0,0,0,0,0,0,0,0,0,0,0,590,Peoples Health,Peoples Health Network.,,"3 Lakeway Center, 3838 North Causeway Boulevard, Suite 2200",Metairie,LA,70002,www.peopleshealth.com,For-profit.,Private.,(504) 849-4500,(800) 222-8600,(504) 849-6983,CVS/Caremark Rx,CVS/Caremark Rx (Rx America),Louisiana.,"Formerly Tenet Choices, Inc. aka Peoples Health Secure Health, Peoples Health Choices Select, Peoples Health Choices Plus, Peoples Health Choices 65, Peoples Health Group Medicare, Peoples Health Network.",TRUE,FALSE,0,0,0,0,0,0,0,0,0,0,0,0,0,0,0,0,0,0,55430,0,0,0,0,0,0,0,0,0,0,0,0,0,0,0,0,0,0,0,0,0,0,0,0,0,0,0,0,0,0,0,0,0,592,Hawaii Medical Service Association,,,P.O. Box 860,Honolulu,HI,96808,www.hmsa.com,Not-for-profit.,Mutual company.,(808) 948-6111,,(808) 948-5567,CVS/Caremark Rx,CVS/Caremark Rx,"Hawaii, plus Medicare Advantage plans in California and Nevada.","Blue Cross Blue Shield of Hawaii, HMO Hawaii, Health Plan Hawaii.",FALSE,TRUE,0,0,0,0,14,0,0,0,0,0,0,722081,0,0,0,0,0,0,0,0,0,0,0,0,0,0,0,0,0,0,0,0,0,29,0,0,0,0,0,0,0,0,0,0,0,0,0,0,0,0,0,0,613,Excellus BlueCross BlueShield,Lifetime Healthcare Companies.,61,165 Court Street,Rochester,NY,14647,www.excellusbcbs.com,Not-for-profit.,Private.,(585) 454-1700,,,"MedImpact Healthcare Systems, FLRx (internal PBM)",Express Scripts (Curascript),New York.,"Upstate HMO; the Excellus Health Plan, Inc.",FALSE,TRUE,0,0,0,0,0,0,0,0,0,0,0,0,0,0,0,0,0,0,0,0,0,0,0,0,0,0,0,0,0,0,0,0,0,0,1720584,0,0,0,0,0,0,0,0,0,0,0,0,0,0,0,0,0,1243,Martins Point Health Care,,,"331 Veranda Street, P.O. Box 9746",Portland,ME,04104,www.martinspoint.org,Not-for-profit.,Private.,(207) 774-5801,(800) 431-0777,,,,"Maine, plus Medicare Advantage plans in New Hampshire.","US Family Health Plan (TRICARE), Generations Advantage, MaineSense.",TRUE,FALSE,0,0,0,0,0,0,0,0,0,0,0,0,0,0,0,0,0,0,0,0,68220,0,0,0,0,0,0,0,0,0,480,0,0,0,0,0,0,0,0,0,0,0,0,0,0,0,0,0,0,0,0,0,1248,Midland Care Connection,"Midland Hospice, Inc.",,200 Southwest Frazier Circle,Topeka,KS,66606,www.midlandcareconnection.org,Not-for-profit.,Private.,(785) 232-2044,(800) 491-3691,(785) 232-5567,,,Kansas.,Midland Care PACE.,TRUE,FALSE,0,0,0,0,0,0,0,0,0,0,0,0,0,0,0,0,100,0,0,0,0,0,0,0,0,0,0,0,0,0,0,0,0,0,0,0,0,0,0,0,0,0,0,0,0,0,0,0,0,0,0,0,1260,Soundpath Health,Catholic Health Initiatives and Physicians of Southwest Washington.,,"32129 Weyerhaeuser Way S, Suite 201",Federal Way,WA,98001,http://soundpathhealth.com,For-profit.,Private.,(253) 779-8830,(866) 789-7747,(253) 779-8829,,,Washington.,Formerly Puget Sound Health Partners,TRUE,FALSE,0,0,0,0,0,0,0,0,0,0,0,0,0,0,0,0,0,0,0,0,0,0,0,0,0,0,0,0,0,0,0,0,0,0,0,0,0,0,0,0,0,0,0,0,0,0,0,16698,0,0,0,0,1388,Piedmont Health SeniorCare,"Piedmont Health Services, Inc.",,1214 Vaughn Road,Burlington,NC,27217,www.piedmonthealthseniorcare.org,Not-for-profit.,Private.,(336) 532-0000,(877) 714-2100,(336) 532-0001,,,North Carolina.,,TRUE,FALSE,0,0,0,0,0,0,0,0,0,0,0,0,0,0,0,0,0,0,0,0,0,0,0,0,0,0,0,107,0,0,0,0,0,0,0,0,0,0,0,0,0,0,0,0,0,0,0,0,0,0,0,0,1389,Santa Fe Employes Hospital Association-Coast Lines,Santa Fe Employees Hospital Association.,,551 East San Bernardino Road,Covina,CA,91723,www.santafeha.com,Not-for-profit,Private.,(626) 967-3550,(877) 968-3550,,,,"Arizona, California.",SFEHACL.,TRUE,FALSE,0,0,0,76,192,0,0,0,0,0,0,0,0,0,0,0,0,0,0,0,0,0,0,0,0,0,0,0,0,0,0,0,0,0,0,0,0,0,0,0,0,0,0,0,0,0,0,0,0,0,0,0,1390,"Siouxland PACE, Inc.","St. Luke's Health System, Inc.",,309 Cook Street,Sioux City,IA,51103,www.unitypoint.org/siouxcity/services-pace.aspx,Not-for-profit,Private.,(712) 224-7223,(888) 722-3713,(712) 224-7250,,,Iowa.,,TRUE,FALSE,0,0,0,0,0,0,0,0,0,0,0,0,101,0,0,0,0,0,0,0,0,0,0,0,0,0,0,0,0,0,0,0,0,0,0,0,0,0,0,0,0,0,0,0,0,0,0,0,0,0,0,0,1391,Total Life Healthcare,St. Bernard's Healthcare.,,225 East Jackson #92,Jonesboro,AR,72401,www.sbrmc.com/departments-services/extended-care/total-life-healthcare,Not-for-profit.,Private.,(870) 207-7500,,(870) 336-5001,Pharmavail Benefits Management,,Arkansas.,,TRUE,FALSE,0,0,102,0,0,0,0,0,0,0,0,0,0,0,0,0,0,0,0,0,0,0,0,0,0,0,0,0,0,0,0,0,0,0,0,0,0,0,0,0,0,0,0,0,0,0,0,0,0,0,0,0,1392,"Total Senior Care, Inc.","Community Care of Western New York, Inc.",,519 North Union Street,Olean,NY,14760,www.totalseniorcare.org,Not-for-profit.,Private.,(716) 379-8474,(866) 939-8613,,,,New York.,,TRUE,FALSE,0,0,0,0,0,0,0,0,0,0,0,0,0,0,0,0,0,0,0,0,0,0,0,0,0,0,0,0,0,0,0,0,0,0,162,0,0,0,0,0,0,0,0,0,0,0,0,0,0,0,0,0,1553,"Simply Healthcare Plans, Inc.",Simply Healthcare Holdings.,113,1701 Ponce De Leon,Coral Gables,FL,33134,www.simplyhealthcareplans.com,For-profit.,Private.,(305) 408-5700,(800) 213-1133,,Catamaran,,Florida.,dba Clear Health Alliance.,FALSE,FALSE,0,0,0,0,0,0,0,0,0,62847,0,0,0,0,0,0,0,0,0,0,0,0,0,0,0,0,0,0,0,0,0,0,0,0,0,0,0,0,0,0,0,0,0,0,0,0,0,0,0,0,0,0,1561,Albright Care Services,Affiliated with United Methodists.,,90 Maplewood Drive,Lewisburg,PA,17837,www.albrightcare.org,Not-for-profit,Private.,(570) 522-3880,(888) 791-0094,,,,Pennsylvania.,Albright LIFE.,TRUE,FALSE,0,0,0,0,0,0,0,0,0,0,0,0,0,0,0,0,0,0,0,0,0,0,0,0,0,0,0,0,0,0,0,0,0,0,0,0,0,0,167,0,0,0,0,0,0,0,0,0,0,0,0,0,406,"Capital Health Plan, Inc.","Blue Cross and Blue Shield of Florida, Inc.",97,P.O. Box 15349,Tallahassee,FL,32317,www.capitalhealth.com,Not-for-profit.,Private.,(850) 383-3311,,(850) 383-3339,Prime Therapeutics,Prime Therapeutics,Florida.,"Licensed affiliate of Blue Cross and Blue Shield of Florida, CHP.",FALSE,FALSE,0,0,0,0,0,0,0,0,0,126135,0,0,0,0,0,0,0,0,0,0,0,0,0,0,0,0,0,0,0,0,0,0,0,0,0,0,0,0,0,0,0,0,0,0,0,0,0,0,0,0,0,0,1080,Touchstone Health,"Touchstone Health Partnership, Inc.",,"One North Lexington Avenue, 12th Floor",White Plains,NY,10601,http://touchstoneh.com,For-profit.,Private.,(914) 288-1000,(888) 777-0204,,PTI/National Pharmaceutical Services,,New York.,,FALSE,FALSE,0,0,0,0,0,0,0,0,0,0,0,0,0,0,0,0,0,0,0,0,0,0,0,0,0,0,0,0,0,0,0,0,0,0,13024,0,0,0,0,0,0,0,0,0,0,0,0,0,0,0,0,0,1369,Fidelis SecureCare,"Fidelis SeniorCare, Inc.",,"20 North Martingale Road, Suite 180",Schaumburg,IL,60173,www.fidelissc.com,For-profit,Private.,(877) 372-8085,,,,,"Michigan, North Carolina.","Fidelis SecureCare of Michigan, Fidelis SecureCare of North Carolina.",TRUE,FALSE,0,0,0,0,0,0,0,0,0,0,0,0,0,0,0,0,0,0,0,0,0,1163,0,0,0,0,0,60,0,0,0,0,0,0,0,0,0,0,0,0,0,0,0,0,0,0,0,0,0,0,0,0,1374,Care N' Care Health Plan,North Texas Specialty Physicians.,,"1701 River Run, Suite 402",Fort Worth,TX,76107,www.cnchealthplan.com,For-profit.,Private.,(877) 374-7993,(800) 994-1076,,,,Texas.,"Care N' Care Insurance Company, Inc.",TRUE,FALSE,0,0,0,0,0,0,0,0,0,0,0,0,0,0,0,0,0,0,0,0,0,0,0,0,0,0,0,0,0,0,0,0,0,0,0,0,0,0,0,0,0,0,0,7562,0,0,0,0,0,0,0,0,1375,Catholic Health LIFE,"Catholic Health Care System, Inc.",,55 Melroy Avenue,Lackawanna,NY,14218,www.chsbuffalo.org/Services/SeniorServices/LIFE,Not-for-profit.,Private.,(716) 819-5433,(716) 706-2112,(716) 819-5433,,,New York.,"Catholic Health System Buffalo PACE, OLV Senior Neighborhood.",TRUE,FALSE,0,0,0,0,0,0,0,0,0,0,0,0,0,0,0,0,0,0,0,0,0,0,0,0,0,0,0,0,0,0,0,0,0,0,150,0,0,0,0,0,0,0,0,0,0,0,0,0,0,0,0,0,1713,Meridian Health Plan of Illinois,Meridian Health Plan,109,"333 South Wabash Avenue, Suite 2900",Chicago,IL,60604,www.mhplan.com/il,For-profit,Private.,(312) 705-2900,(866) 606-3700,(312) 980-0404,Meridian Rx,Meridian Rx,Illinois.,,FALSE,FALSE,0,0,0,0,0,0,0,0,0,0,0,0,0,0,23246,0,0,0,0,0,0,0,0,0,0,0,0,0,0,0,0,0,0,0,0,0,0,0,0,0,0,0,0,0,0,0,0,0,0,0,0,0,695,Blue Cross & Blue Shield of Rhode Island,,,500 Exchange Street,Providence,RI,02903,www.bcbsri.com,Not-for-profit,Private.,(401) 459-5000,(800) 639-2227,(401) 459-5885,Catamaran Corporation,CVS/Caremark Rx,Rhode Island.,Coordinated Health Partners is the HMO subsidiary of Blue Cross and Blue Shield of Rhode Island.,FALSE,TRUE,249,2,97,893,2362,794,5860,83,143,5580,1039,14,66,36,1364,315,118,159,181,43779,943,345,1004,258,33,404,64,2125,1,19,1220,1527,28,250,3186,780,128,97,1172,340681,778,20,658,3210,73,1235,286,378,280,59,46,31,1708,Blue Cross Blue Shield of Arizona,,,2444 West Las Palmaritas Drive,Phoenix,AZ,85021,www.azblue.com,Not-for-profit.,Private.,(602) 864-4899,(602) 864-4400,(602) 864-4035,MemberHealth,,"Arizona, plus Medicare Advantage plans in D.C. and Washington.","Medisun, Inc., MedStar Family Choice, Inc.",FALSE,TRUE,0,0,0,575747,0,0,0,78,0,0,0,0,0,0,0,0,0,0,0,0,0,0,0,0,0,0,0,0,0,0,0,0,0,0,0,0,0,0,0,0,0,0,0,0,0,0,0,18,0,0,0,0,136,Blue Shield of California,California Physicians' Service.,,50 Beale Street,San Francisco,CA,94105,www.blueshieldca.com,Not-for-profit.,Private.,(415) 229-5359,(888) 568-3560,(415) 229-6240,Blue Shield of California,"CVS/Caremark Rx, Walgreens Specialty Pharmacy (Outpatient Rx)",California.,California Physicians' Service.,FALSE,TRUE,0,0,0,0,2941465,0,0,0,0,0,0,0,0,0,0,0,0,0,0,0,0,0,0,0,0,0,0,0,0,0,0,0,0,0,0,0,0,0,0,0,0,0,0,0,0,0,0,0,0,0,0,0,142,Inland Empire Health Plan,,,P.O. Box 1800,Rancho Cucamonga,CA,91729-1800,www.iehp.org,Not-for-profit.,,(909) 890-2000,,(909) 890-2003,Argus Health Systems,,California.,,FALSE,FALSE,0,0,0,0,646052,0,0,0,0,0,0,0,0,0,0,0,0,0,0,0,0,0,0,0,0,0,0,0,0,0,0,0,0,0,0,0,0,0,0,0,0,0,0,0,0,0,0,0,0,0,0,0,144,Community Health Group,,,740 Bay Boulevard,Chula Vista,CA,92021,www.chgsd.com,Not-for-profit.,Private.,(619) 422-0422,(800) 840-0089,(619) 422-5930,MedImpact Healthcare Systems,,California.,CommuniCare Advantage.,FALSE,FALSE,0,0,0,0,155736,0,0,0,0,0,0,0,0,0,0,0,0,0,0,0,0,0,0,0,0,0,0,0,0,0,0,0,0,0,0,0,0,0,0,0,0,0,0,0,0,0,0,0,0,0,0,0,34,MVP Health Care,"MVP Health Care, Inc.",,625 State Street,Schenectady,NY,12305,www.DiscoverMVP.com,Not-for-profit.,Private.,(518) 370-4793,(888) 687-6277,(518) 370-0852,Express Scripts,Express Scripts (Curascript),"New Hampshire, New York, Vermont, plus Medicare Advantage plans in other states.","Formerly MVP Health Plan; Hudson Health Plan, Rochester Area HMO/Preferred Care, Mohawk Valley Physicians Health Plan, Preferred Gold.",FALSE,FALSE,160,3,37,248,801,1617,1692,6,69,1801,1773,7,85,24,485,151,42,77,52,2272,277,180,261,455,18,143,20,602,1,30,6743,1448,23,103,543991,1248,123,771,1999,98,440,16,225,946,105,299,38626,122,126,13,14,7,1039,"Health Plan of the Upper Ohio Valley, Inc.",The Health Plan of the Upper Ohio Valley.,,52160 National Road East,St. Clairsville,OH,43950,www.healthplan.org,Not-for-profit,Private.,(740) 695-3585,(800) 624-6961,(740) 695-5297,Express Scripts (Medco),"Express Scripts/Medco), Specialty Scripts Pharmacy",Ohio and West Virginia.,"THP Insurance Company; Hometown Health Plan; The Health Plan; Health Plan SecureChoice, Mountain Health Trust.",FALSE,FALSE,0,0,0,0,0,0,0,0,0,0,0,0,0,0,0,0,0,0,0,0,0,0,0,0,0,0,0,0,0,0,0,0,0,0,0,35998,0,0,0,0,0,0,0,0,0,0,0,0,0,72168,0,0,45,"Kaiser Foundation Health Plan of Georgia, Inc.",Kaiser Permanente.,26,"3495 Piedmont Road, NE",Atlanta,GA,30305,www.kp.org,Not-for-profit.,Private.,(404) 364-7243,(404) 261-2590,(404) 812-6530,Kaiser Permanente owned and managed pharmacies,MedImpact Healthcare Systems,Georgia.,"Senior Advantage, Multi Choice, Signature HMO.",FALSE,FALSE,0,0,0,0,0,0,0,0,0,0,229138,0,0,0,0,0,0,0,0,0,0,0,0,0,0,0,0,0,0,0,0,0,0,0,0,0,0,0,0,0,0,0,0,0,0,0,0,0,0,0,0,0,260,"Elderplan, Inc.",Metropolitan Jewish Health System.,,6323 Seventh Avenue,Brooklyn,NY,11220,www.elderplan.org,Not-for-profit.,Private.,(718) 921-7979,(800) 353-3765,(718) 921-7962,Envision Pharmaceutical Services,,New York.,HomeFirst (Medicaid).,TRUE,FALSE,0,0,0,0,0,0,0,0,0,0,0,0,0,0,0,0,0,0,0,0,0,0,0,0,0,0,0,0,0,0,0,0,0,0,24808,0,0,0,0,0,0,0,0,0,0,0,0,0,0,0,0,0,23,Mercy Care Plan,"Southwest Catholic Health Network. Administered by Schaller Anderson, LLC, an Aetna Company.",9,"4350 East Cotton Center Boulevard, Building D",Phoenix,AZ,85040,www.mercycareplan.com,Not-for-profit.,Private.,(602) 263-3000,(800) 624-3879,,,,Arizona.,,TRUE,FALSE,0,0,0,342716,0,0,0,0,0,0,0,0,0,0,0,0,0,0,0,0,0,0,0,0,0,0,0,0,0,0,0,0,0,0,0,0,0,0,0,0,0,0,0,0,0,0,0,0,0,0,0,0,9,Arkansas BlueCross BlueShield,Arkansas BlueCross BlueShield.,95,601 South Gaines Street,Little Rock,AR,72201,www.arkbluecross.com,Not-for-profit.,Private.,(501) 378-2000,(800) 238-8379,,CVS/Caremark Rx,CVS/Caremark Rx,Arkansas.,USAble Mutual Insurance Company.,FALSE,TRUE,0,0,399057,0,0,0,0,0,0,0,0,0,0,0,0,0,0,0,0,0,0,0,0,0,0,0,0,0,0,0,0,0,0,0,0,0,0,0,0,0,0,0,0,0,0,0,0,0,0,0,0,0,10,Blue Cross and Blue Shield of Alabama,,,450 Riverchase Parkway East,Birmingham,AL,35244,www.bcbsal.com,Not-for-profit.,Private.,(205) 220-2100,(800) 292-8868,(205) 220-2949,Prime Therapeutics,,Alabama and Nationwide.,,FALSE,TRUE,2092382,1368,16581,9237,38204,8176,4508,239,865,73341,78609,171,16375,3762,31508,38833,4998,44906,21692,8185,2302,22748,7993,10637,43584,19832,1725,58389,704,4077,2966,9783,3604,5024,20194,37536,5704,4245,25217,1342,31565,1286,56913,83497,3711,33161,706,9770,12736,6920,1480,36,266,AultCare Insurance Company,Aultman Health Foundation/SQCP.,,"2600 Sixth Street, SW",Canton,OH,44710,www.aultcare.com,Not-for-profit.,Private.,(330) 363-6360,(800) 344-8858,(330) 454-7845,"Pharmacy Data Management, Inc. (PDMI)",,"Ohio, plus Medicare Advantage plans in other states.","AultCare Health Plans, McKinley Life Insurance Company, AultCare Corporation.",TRUE,FALSE,0,0,0,0,0,0,11,0,0,0,13,0,0,0,0,0,0,0,0,0,0,0,0,0,0,0,0,26,0,0,65,0,0,0,0,422703,0,0,18,0,67,0,0,0,0,0,0,0,0,97,0,0,277,BlueCross BlueShield of Western New York and BlueShield of Northeastern New York,"HealthNow New York, Inc.",,257 West Genesee Street,Buffalo,NY,14202,www.bcbswny.com; www.bsneny.com,Not-for-profit.,Private.,(716) 887-6900,,,Express Scripts,"Walgreens Specialty Pharmacy (Option Care), Express Scripts (Curascript and Medco/Accredo Health Group)","New York, plus Medicare Advantage plans in other states.",,FALSE,TRUE,1779,134,466,847,3941,465,2152,37,95,6931,2006,14,278,1875,2273,1194,404,876,826,1686,211,2623,414,733,1071,742,33,3560,109,85,271,1906,148,324,537011,3387,348,412,11678,80,2005,43,869,3817,1879,3365,457,1079,1456,533,57,11,223281,Blue Cross and Blue Shield of Minnesota,Aware Integrated Incorporated.,,P.O. Box 64560,St. Paul,MN,55164,www.bluecrossmn.com,Not-for-profit.,Private.,(651) 662-8000,(800) 382-2000,(651) 662-1502,Prime Therapeutics,,"Minnesota, plus Medicare Advantage in other states.","Blue Plus, First Plan of Minnesota, HMO Minnesota, MII Life.",FALSE,TRUE,0,0,0,114,0,0,0,0,0,28,0,0,0,0,0,0,0,0,0,0,0,0,0,2425936,0,0,0,0,0,0,0,0,0,0,0,0,0,0,0,0,0,0,0,22,0,0,0,0,0,0,0,0,207,Metropolitan Health Plan (MHP),Hennepin County.,,"400 South Fourth Street, Suite 201",Minneapolis,MN,55415,www.hennepin.us/mhp,Not-for-profit.,Government.,(800) 647-0550,,,CVS/Caremark Rx,,Minnesota.,Hennepin Health.,FALSE,FALSE,0,0,0,0,0,0,0,0,0,0,0,0,0,0,0,0,0,0,0,0,0,0,0,10274,0,0,0,0,0,0,0,0,0,0,0,0,0,0,0,0,0,0,0,0,0,0,0,0,0,0,0,0,208,UCare,,,P.O. Box 52,Minneapolis,MN,55440-0052,www.ucare.org,Not-for-profit.,Private.,(612) 676-6500,(888) 531-1493,(612) 676-6501,Express Scripts,Express Scripts (Accredo),"Minnesota, Wisconsin.","UCare Health, Ucare Minnesota, UCare for Seniors, MinnesotaCare.",FALSE,FALSE,0,0,0,0,0,0,0,0,0,0,0,0,0,0,0,0,0,0,0,0,0,0,0,306673,0,0,0,0,0,0,0,0,0,0,0,0,0,0,0,0,0,0,0,0,0,0,0,0,7068,0,0,0,0210,Affinity Health Plan,Affinity Health System.,88,2500 Halsey Street,Bronx,NY,10461,www.affinityplan.org,Not-for-profit.,Private.,(718) 794-7700,(866) 206-1775,(718) 794-7800,CVS/Caremark Rx,CVS/Caremark Rx,New York.,"fka The Bronx Health Plan (TBHP), GENESIS Health Plan.",TRUE,FALSE,0,0,0,0,0,0,0,0,0,0,0,0,0,0,0,0,0,0,0,0,0,0,0,0,0,0,0,0,0,0,0,0,0,0,254761,0,0,0,0,0,0,0,0,0,0,0,0,0,0,0,0,0,74,Regence BlueShield,Cambia Health Solutions.,7,"1800 9th Avenue, P.O. Box 21267",Seattle,WA,98101,www.wa.regence.com,Not-for-profit.,Private.,(206) 464-3600,(888) 344-5593,,RegenceRx,Walgreens Specialty Pharmacy,Washington.,,FALSE,TRUE,0,0,0,0,0,0,0,0,0,0,0,0,0,0,0,0,0,0,0,0,0,0,0,0,0,0,0,0,0,0,0,0,0,0,0,0,0,0,0,0,0,0,0,0,0,0,0,770512,0,0,0,0,679,FirstCare Health Plans,Covenant Health System and Hendrick Medical Center.,,12940 North Highway 183,Austin,TX,78750,www.firstcare.com,For-profit.,Private.,(512) 257-6000,(800) 884-4901,(877) 878-8422,"Express Scripts, Inc.","Express Scripts, Inc.",Texas.,"SHA, LLC; Southwest Life & Health FirstCare PPO.",TRUE,FALSE,0,0,0,0,0,0,0,0,0,0,0,0,0,0,0,0,0,0,0,0,0,0,0,0,0,0,0,0,0,0,0,0,0,0,0,0,0,0,0,0,0,0,0,167546,0,0,0,0,0,0,0,0,199,"SummaCare Health Plan, Inc.",Summa Health System.,,10 North Main Street,Akron,OH,44308,www.summacare.com,For-profit.,Private.,(330) 966-8410,(800) 966-8411,(330) 996-8454,MedImpact Healthcare Systems,Walgreens Specialty Pharmacy,"Florida, Maryland, Ohio, Tennessee.",SummaCare Medicare Advantage Plans.,TRUE,FALSE,0,0,0,0,0,0,0,0,0,1924,0,0,0,0,0,0,0,0,0,0,0,0,65,0,0,0,0,0,0,0,0,0,0,0,0,144319,0,0,0,0,0,0,13522,0,0,0,0,0,0,0,0,0,420,Blue Cross Blue Shield of Massachusetts,,,401 Park Drive,Boston,MA,02215,www.bluecrossma.com,Not-for-profit.,Private.,(617) 246-5000,(800) 253-5210,(617) 246-4832,Express Scripts,,Massachusetts.,HMO Blue,FALSE,TRUE,0,0,0,0,0,0,0,0,0,0,0,0,0,0,0,0,0,0,0,2756760,0,0,0,0,0,0,0,0,0,0,0,0,0,0,0,0,0,0,0,0,0,0,0,0,0,0,0,0,0,0,0,0,433,Dean Health Plan,Dean Health System.,,1277 Deming Way,Madison,WI,53717,www.deancare.com,For-profit.,Private.,(800) 356-7344,(608) 827-4420,(608) 827-4212,Navitus Health Solutions,Specialty Scripts,Wisconsin.,"Dean Health Insurance, Inc.",TRUE,FALSE,0,0,0,0,0,0,0,0,0,0,0,0,0,0,0,0,0,0,0,0,0,0,0,0,0,0,0,0,0,0,0,0,0,0,0,0,0,0,0,0,0,0,0,0,0,0,0,0,264419,0,0,0,437,Gundersen Health Plan,Gundersen Health System,,1836 South Avenue,La Crosse,WI,54601,www.gundersenhealthplan.org,Not-for-profit.,Private.,(608) 775-8000,(800) 370-9718,(608) 775-8091,ClearScripts/Argus,,"Iowa, Minnesota, Wisconsin.","fka Gundersen Lutheran Health Plan, Inc.",TRUE,FALSE,0,0,0,0,0,0,0,0,0,0,0,0,192,0,0,0,0,0,0,0,0,0,0,364,0,0,0,0,0,0,0,0,0,0,0,0,0,0,0,0,0,0,0,0,0,0,0,0,89209,0,0,0,438,MercyCare Health Plans,Mercy Health System Corporation.,,3430 Palmer Drive,Janesville,WI,53547,www.mercycarehealthplans.com,For-profit.,Private.,(608) 752-3431,(800) 752-3431,(608) 752-3751,"CVS/Caremark Rx, Mercy Health System Pharmacies",,Wisconsin.,"MercyCare HMO, Inc.; MercyCare Insurance Company, Inc.",TRUE,FALSE,0,0,0,0,0,0,0,0,0,0,0,0,0,0,0,0,0,0,0,0,0,0,0,0,0,0,0,0,0,0,0,0,0,0,0,0,0,0,0,0,0,0,0,0,0,0,0,0,36237,0,0,0,439,Network Health,"Ministry Health Care, Inc.",88,1570 Midway Place,Menasha,WI,54952,www.networkhealth.com,For-profit.,Private.,(920) 720-1300,(800) 826-0940,(920) 720-1900,"Express Scripts, CVS/Caremark Rx",,Wisconsin.,Network Health Insurance Corp.,TRUE,FALSE,0,0,0,0,0,0,0,0,0,0,0,0,0,0,0,0,0,0,0,0,0,0,0,0,0,0,0,0,0,0,0,0,0,0,0,0,0,0,0,0,0,0,0,0,0,0,0,0,166808,0,0,0,450,BlueCross BlueShield of Tennessee,"BlueCross BlueShield of Tennessee, Inc.",,1 Cameron Hill Circle,Chattanooga,TN,37402,www.bcbst.com,Not-for-profit.,Private.,(423) 535-5600,(800) 565-9140,(423) 535-6355,Express Scripts,Express Scripts,Tennessee and Nationwide.,"Volunteer State Health Plan, TennCare, BlueCare, SharedHealth, BlueAdvantage, BlueElite, OnLife, BlueCard, BlueAccess, BluePerks.",FALSE,TRUE,34529,1514,14128,12314,20121,8926,2072,582,790,28293,41470,69,3783,2943,20816,15256,3986,31721,11455,3705,4101,11215,4994,2460,37681,14350,1123,22713,245,2249,1306,3750,8239,2450,6635,22813,8420,4313,10582,913,16505,1140,2583822,51243,3648,191,23371,7123,3984,8737,2040,20,42456,Regence BlueCross BlueShield of Oregon,Cambia Health Solutions.,7,100 Southwest Market Street,Portland,OR,97201,www.or.regence.com,Not-for-profit.,Private.,(503) 225-5221,(800) 452-7278,(503) 225-4848,RegenceRx,Walgreens Specialty Pharmacy,Oregon.,Pioneer Educators Health Trust.,FALSE,TRUE,0,0,0,0,0,0,0,0,0,0,0,0,0,0,0,0,0,0,0,0,0,0,0,0,0,0,0,0,0,0,0,0,0,0,0,0,0,518593,0,0,0,0,0,0,0,0,0,0,0,0,0,0,1264,"WellPoint, Inc.","WellPoint, Inc.",3,120 Monument Circle,Indianapolis,IN,46204,www.wellpoint.com,For-profit.,Public.,(317) 488-6000,,,Express Scripts,,"Nationwide. Blue Cross or Blue Shield licensee in the following states: California, Colorado, Connecticut, Georgia, Indiana, Kentucky, Maine, Missouri, Nevada, New Hampshire, New York, Ohio, Virginia, and Wisconsin.","The following subsidiaries and brands are included in this record: AMERIGROUP, Americaid, Anthem subsidiaries in California, Colorado, Connecticut, Florida, Indiana, Kentucky, Maine, Nevada, New Hampshire, Ohio, Virginia and Wisconsin; Atrium Health Care, Blue Cross Blue Shield of Georgia, Blue Cross of California, CareMore Health Group, Community Insurance Company, CompCare, Empire Blue Cross Blue Shield, INTotal Health, Healthkeepers, HealthLink HMO, Healthplus, Healthy Alliance, HMO Colorado, HMO Missouri, Matthew Thornton Health Plan, Peninsula Health Care, Priority Health Care, RightChoice Managed Care, Rocky Mountain Hospital & Medical Service, UNICARE.",FALSE,TRUE,11,0,0,17127,2811870,481119,533583,0,15,237507,1293806,15,0,25,269347,1994680,119982,598392,128368,26,230295,0,224864,0,0,612914,0,33,0,1225,215782,150924,24033,104404,2104118,1665611,16,130,491,0,49,0,201740,832098,25,2098791,0,34364,414719,86345,0,0,1284,ATRIO Health Plans,"Douglas County Individual Practice Association (DCIPA), and Cascade Comprehensive Care (CCC).",,"2270 NW Aviation Drive, Suite 3",Roseburg,OR,97470,www.ATRIOhp.com,For-profit.,Private.,(541) 672-8620,(877) 672-8620,(541) 672-8670,,,Oregon.,Formerly listed under Douglas County IPA.,TRUE,FALSE,0,0,0,0,0,0,0,0,0,0,0,0,0,0,0,0,0,0,0,0,0,0,0,0,0,0,0,0,0,0,0,0,0,0,0,0,0,12897,0,0,0,0,0,0,0,0,0,0,0,0,0,0,1808,"Windsor Health Plan, Inc.","Munich Health North America, Inc.",108,"7100 Commerce Way, Suite 285",Brentwood,TN,37027,www.windsorhealthplan.com,For-profit,Private subsidiary of public company.,(615) 782-7800,,(615) 782-7828,CVS/Caremark Rx,,"Alabama, Arkansas, Idaho, Illinois, Mississippi, Montana, South Carolina, Tennessee.",Munich Health North America/Windsor Health Group. Windsor Medicare Extra (HMO).,FALSE,FALSE,475,0,13621,0,0,0,0,0,0,0,0,0,0,60,15,0,0,0,0,0,0,0,0,0,20462,0,105,0,0,0,0,0,0,0,0,0,0,0,0,0,7994,0,15826,0,0,0,0,0,0,0,0,0,0